{
 "$schema":"https://json-schema.org/draft/2020-12/schema","$id":"https://adp.dev/schema/worker-descriptor.schema.json","title":"WorkerDescriptor","type":"object","additionalProperties":false,"required":["specVersion","id","capabilities"],
 "properties":{"specVersion":{"const":"0.1"},"id":{"type":"string","minLength":1},"name":{"type":"string"},"capabilities":{"type":"array","items":{"type":"string"},"uniqueItems":true},"authorityMax":{"$ref":"authority.schema.json"},"locality":{"type":"object","additionalProperties":false,"required":["kind"],"properties":{"kind":{"enum":["local","remote","hybrid"]}}},"supportedWorkspaceModes":{"type":"array","items":{"enum":["shared","read_only","worktree","sandbox","remote"]},"uniqueItems":true},"supportedFeatures":{"type":"object","additionalProperties":false,"properties":{"suspension":{"type":"boolean"},"nestedDelegation":{"type":"boolean"},"artifacts":{"type":"boolean"},"streaming":{"type":"boolean"}}},"supportedBudgetDimensions":{"type":"array","items":{"enum":["cost","inputTokens","outputTokens","totalTokens","wallClockMs","childDelegations"]}},"models":{"type":"array","items":{"type":"object","additionalProperties":false,"required":["id"],"properties":{"id":{"type":"string"},"provider":{"type":"string"},"metadata":{"type":"object","additionalProperties":{"type":"string"}}}}},"capacity":{"type":"object","additionalProperties":false,"properties":{"available":{"type":"boolean"},"queueDepth":{"type":"integer","minimum":0},"estimatedWaitMs":{"type":"integer","minimum":0}}},"metadata":{"type":"object","additionalProperties":{"type":"string"}}}
}
