{"specVersion":"0.1","id":"typescript-coding-worker","name":"TypeScript coding worker","capabilities":["shell","test","repository.inspect"],"locality":{"kind":"local"},"supportedWorkspaceModes":["read_only","worktree","sandbox"],"supportedFeatures":{"suspension":true,"nestedDelegation":true,"artifacts":true,"streaming":true},"supportedBudgetDimensions":["totalTokens","wallClockMs","childDelegations"],"capacity":{"available":true,"queueDepth":0},"metadata":{"profile":"general-typescript"}}
